{
  "version": "3.1.0",
  "dna": {
    "theme": {
      "id": "luminarum",
      "mode": "dark",
      "shape": "pill"
    },
    "spacing": {
      "base_unit": 4,
      "scale": "linear",
      "density": "comfortable",
      "content_gap": "_gap4"
    },
    "typography": {
      "scale": "modular",
      "heading_weight": 600,
      "body_weight": 400
    },
    "color": {
      "palette": "semantic",
      "accent_count": 1,
      "cvd_preference": "auto"
    },
    "radius": {
      "philosophy": "rounded",
      "base": 8
    },
    "elevation": {
      "system": "layered",
      "max_levels": 3
    },
    "motion": {
      "preference": "subtle",
      "duration_scale": 1,
      "reduce_motion": true
    },
    "accessibility": {
      "wcag_level": "AA",
      "focus_visible": true,
      "skip_nav": true
    },
    "personality": [
      "Vibrant design intelligence registry. Warm coral and amber accents on a rich dark canvas (or crisp warm-white in light mode). Content cards are the hero — outlined with colored type borders, hovering with purpose. Search is instant and faceted. Publishing feels like sharing art. The Decantr dogfood app — built with its own system, proudly showing what the platform produces. Think Figma Community meets shadcn/ui registry."
    ]
  },
  "blueprint": {
    "sections": [
      {
        "id": "registry-browser",
        "role": "primary",
        "shell": "top-nav-main",
        "features": [
          "search",
          "pagination"
        ],
        "description": "Public content browsing for a design registry. Search, filter, and explore patterns, themes, blueprints, archetypes, recipes, and shells.",
        "pages": [
          {
            "id": "homepage",
            "layout": [
              "hero",
              "search-filter-bar",
              "content-card-grid",
              "kpi-grid"
            ],
            "route": "/"
          },
          {
            "id": "browse",
            "layout": [
              "search-filter-bar",
              "content-card-grid"
            ],
            "route": "/browse"
          },
          {
            "id": "browse-type",
            "layout": [
              "search-filter-bar",
              "content-card-grid"
            ],
            "route": "/browse/:type"
          },
          {
            "id": "detail",
            "layout": [
              "content-detail-hero",
              "json-viewer"
            ],
            "route": "/:type/:namespace/:slug"
          },
          {
            "id": "profile",
            "layout": [
              "detail-header",
              "content-card-grid",
              "activity-feed"
            ],
            "route": "/profile/:username"
          }
        ]
      },
      {
        "id": "user-dashboard",
        "role": "primary",
        "shell": "sidebar-main",
        "features": [
          "auth",
          "api-keys"
        ],
        "description": "Authenticated user area with content management, API key management, account settings, and activity overview.",
        "pages": [
          {
            "id": "overview",
            "layout": [
              "kpi-grid",
              "reputation-badge",
              "activity-feed"
            ],
            "route": "/dashboard"
          },
          {
            "id": "content",
            "layout": [
              "content-card-grid"
            ],
            "route": "/dashboard/content"
          },
          {
            "id": "content-new",
            "layout": [
              "form",
              "json-viewer"
            ],
            "route": "/dashboard/content/new"
          },
          {
            "id": "api-keys",
            "layout": [
              "api-key-row"
            ],
            "route": "/dashboard/api-keys"
          },
          {
            "id": "settings",
            "layout": [
              "account-settings"
            ],
            "route": "/dashboard/settings"
          },
          {
            "id": "billing",
            "layout": [
              "tier-upgrade-card",
              "kpi-grid"
            ],
            "route": "/dashboard/billing"
          },
          {
            "id": "team",
            "layout": [
              "kpi-grid",
              "team-member-row"
            ],
            "route": "/dashboard/team"
          }
        ]
      },
      {
        "id": "admin-moderation",
        "role": "auxiliary",
        "shell": "sidebar-main",
        "features": [
          "auth",
          "admin"
        ],
        "description": "Admin moderation queue for reviewing, approving, and rejecting community-submitted registry content.",
        "pages": [
          {
            "id": "moderation-queue",
            "layout": [
              "search-filter-bar",
              "moderation-queue-item"
            ],
            "route": "/admin/moderation"
          },
          {
            "id": "moderation-detail",
            "layout": [
              "content-detail-hero",
              "json-viewer",
              "moderation-queue-item"
            ]
          }
        ]
      },
      {
        "id": "auth-flow",
        "role": "gateway",
        "shell": "centered",
        "features": [
          "auth"
        ],
        "description": "Login, registration, and password recovery with OAuth support",
        "pages": [
          {
            "id": "login",
            "layout": [
              "auth-form"
            ],
            "route": "/login"
          },
          {
            "id": "register",
            "layout": [
              {
                "preset": "register",
                "pattern": "auth-form"
              }
            ]
          },
          {
            "id": "forgot-password",
            "layout": [
              {
                "preset": "reset",
                "pattern": "auth-form"
              }
            ]
          }
        ]
      }
    ],
    "features": [
      "search",
      "pagination",
      "auth",
      "api-keys",
      "admin"
    ],
    "routes": {
      "/": {
        "section": "registry-browser",
        "page": "homepage"
      },
      "/login": {
        "section": "auth-flow",
        "page": "login"
      },
      "/browse": {
        "section": "registry-browser",
        "page": "browse"
      },
      "/dashboard": {
        "section": "user-dashboard",
        "page": "overview"
      },
      "/browse/:type": {
        "section": "registry-browser",
        "page": "browse-type"
      },
      "/dashboard/team": {
        "section": "user-dashboard",
        "page": "team"
      },
      "/admin/moderation": {
        "section": "admin-moderation",
        "page": "moderation-queue"
      },
      "/dashboard/billing": {
        "section": "user-dashboard",
        "page": "billing"
      },
      "/dashboard/content": {
        "section": "user-dashboard",
        "page": "content"
      },
      "/profile/:username": {
        "section": "registry-browser",
        "page": "profile"
      },
      "/dashboard/api-keys": {
        "section": "user-dashboard",
        "page": "api-keys"
      },
      "/dashboard/settings": {
        "section": "user-dashboard",
        "page": "settings"
      },
      "/dashboard/content/new": {
        "section": "user-dashboard",
        "page": "content-new"
      },
      "/:type/:namespace/:slug": {
        "section": "registry-browser",
        "page": "detail"
      }
    }
  },
  "meta": {
    "archetype": "registry-browser",
    "target": "react",
    "platform": {
      "type": "spa",
      "routing": "hash"
    },
    "guard": {
      "mode": "guided",
      "dna_enforcement": "error",
      "blueprint_enforcement": "off"
    },
    "seo": {
      "schema_org": [
        "WebApplication",
        "SoftwareApplication"
      ],
      "meta_priorities": [
        "description",
        "og:image",
        "twitter:card"
      ]
    },
    "navigation": {
      "hotkeys": [
        {
          "key": "g b",
          "label": "Browse Registry",
          "route": "/browse"
        },
        {
          "key": "g d",
          "label": "Dashboard",
          "route": "/dashboard"
        },
        {
          "key": "g s",
          "label": "Settings",
          "route": "/dashboard/settings"
        }
      ],
      "command_palette": true
    }
  }
}
